{
  "schemaVersion": 1,
  "kind": "ArtifactDeleted",
  "recordedAt": "2026-10-09T14:04:23Z",
  "source": {
    "type": "github-actions",
    "workflow": "promote from quarantine / quarantine/node",
    "runUrl": "https://github.com/toddysm/cssc-framework/actions/runs/37941368401",
    "runId": "37941368401",
    "runAttempt": "1"
  },
  "occurrence": {
    "registry": "ghcr.io",
    "repository": "toddysm/quarantine/node"
  },
  "digest": "sha256:3b24be658a434e60f05232359033101ace3956fd4eed136767240f35addab428",
  "reason": "promoted",
  "deletedAt": "2026-10-09T14:04:23Z",
  "tag": "sha256-4f22b1404300055a45ed81bca214b9cf1f24d49bab340c8badf74fb274af4d39",
  "id": "sha256:56cc8a283a94659b82b7c6dab590fbc60eee515d309e4c2d55e9bc8956232ebb"
}
