{
  "schemaVersion": 1,
  "kind": "ArtifactDeleted",
  "recordedAt": "2026-08-29T03:37:23Z",
  "source": {
    "type": "github-actions",
    "workflow": "promote override",
    "runUrl": "https://github.com/toddysm/cssc-framework/actions/runs/33231835821",
    "runId": "33231835821",
    "runAttempt": "1"
  },
  "occurrence": {
    "registry": "ghcr.io",
    "repository": "toddysm/quarantine/node"
  },
  "digest": "sha256:2d984a15c9b54fd0aeb608b8e0d0d83529eb34d2966db27a1fb4f1edc3d298a3",
  "reason": "promoted",
  "deletedAt": "2026-08-29T03:37:23Z",
  "tag": "26-alpine",
  "id": "sha256:fd71a385035656379b8ca789182aa2698d941d2eba639ee9c5171833bf2c0839"
}
