{
  "schemaVersion": 1,
  "kind": "ArtifactDeleted",
  "recordedAt": "2026-09-23T12:30:30Z",
  "source": {
    "type": "github-actions",
    "workflow": "promote from quarantine / quarantine/node",
    "runUrl": "https://github.com/toddysm/cssc-framework/actions/runs/35860808145",
    "runId": "35860808145",
    "runAttempt": "1"
  },
  "occurrence": {
    "registry": "ghcr.io",
    "repository": "toddysm/quarantine/node"
  },
  "digest": "sha256:6bb810d7a220f213317dae4b0711b0fc2980cb30762f5006d509aee42908da95",
  "reason": "promoted",
  "deletedAt": "2026-09-23T12:30:30Z",
  "id": "sha256:fe862b4738c4bb9dbc6c56687d93138ec7af59524596f8ce9d25020845ec8169"
}
