{
  "schemaVersion": 1,
  "kind": "ArtifactDeleted",
  "recordedAt": "2026-09-23T12:30:30Z",
  "source": {
    "type": "github-actions",
    "workflow": "promote from quarantine / quarantine/node",
    "runUrl": "https://github.com/toddysm/cssc-framework/actions/runs/35860808145",
    "runId": "35860808145",
    "runAttempt": "1"
  },
  "occurrence": {
    "registry": "ghcr.io",
    "repository": "toddysm/quarantine/node"
  },
  "digest": "sha256:0b36e8c136b94cd4fcf02188228e76c31ad5872eef3fec8cbd2eee500cfd9e80",
  "reason": "promoted",
  "deletedAt": "2026-09-23T12:30:30Z",
  "tag": "26-alpine",
  "id": "sha256:74048ad21f942519438baedab84774c156c78ded108476f5e880d9e142348f8e"
}
